id,query
386,web brower with list
219,Tabs layout preview
34,healthcare pulse app
266,contact details form
57,Navigation app with setting location and destination
190,trending page
384,Sidebar with homepage and other options
149,Spanish news with figuers and search option
192,side panel with share and settings
101,Setting screen of a time planer
122,Customer support notofication page
118,"Application with weekly ad, rewards, account, products and projects that can be add to My List"
59,dictionary page  with words shown
367,complete your melody
93,the latest updates of football matches
238,2D model of solunar clock
177,arabican news overview with articles
289,Timer with play button
144,short tutorial and instructions for a game with option to go back to previous menu
352,calculator
449,starting screen of Amino
272,learning and play piano online
363,weather notification with toggle button
222,settings and options in a Gym App
79,Buy atlanta falcons jersey
264,Web ad for an children learning app
369,my playlist
92,show map
351,snapchat startup interface with login and sign up options
274,accounting software with excel file output format
204,Startup screen with login & sign up options and a logo
250,settings to adjust
300,a panel app window with its points
197,expense manager
125,Months of a year from January to November with a radio button to choose
88,informative list contents
417,Gallery app with thumbnails overview
136,A guy picture on a social network
319,page that display the questions  with options
454,Advertisment of FedEx
47,Fashion dressing ideas with image overview
29,search bar with list of computer accessories categories
90,Menstrual calendar with body temperature
26,Genesis + Book + Android
75,best food recipes
5,Selection of Doctor's Specialization
298,music
384,Product description and shipping information
63,"option bar, multiple preview of data"
179,"tourist app, discover world places, countries and cities"
36,bookmark
272,add location by pinning the place
168,"Expandable List item and Bottom Nav bar with Live, history, Stat, Check No. and More Items"
80,Information with detailed explanation text of fitness exercises and a corresponding graphic
21,near  important places
416,login page
91,"weather details with temperature, pressure and relative humidity"
164,Overview over own accounts and the amount of money on them
1,application submission screen for successfully submitted application
275,summery  of a questionnaire
117,Media with no search results
453,turkish car sales website
8,shopping app with item weight description
305,strike count threshold with disabling  feature and limits ranging from 1 to 50
205,choise of interest
85,open with notification with paly store or browser
152,directory for saving contact information of various establishments
260,Chinese salad recipes
116,weight loss foods blog
211,Libary list with the united states of america
226,pop up ads
49,Mobile Home Screen Background
74,"Shop for Men's,Women's and Kids"
24,"create, search or download anime girls images"
54,celebrity news
285,screen with sample movies and information on recording with SnapMovie
365,Ui for user profile
109,sports news overview
3,home appliances
7,"diaper-magen with style, color and texture"
187,File explorer with recently accessed image files sorted chronologically
324,Sending Email to Selected Recipient's
54,Information with sharing and saving option
457,Management
27,Navigation Drawer
60,page not found report with search bar and recent posts
126,android news website
198,"SOY LUNA MUSICA-Disney Channel Latin America, all shows and broadcast musical TV series"
462,"Menu bar with change platform, home, squad builder, consumables, tax calculator, TOTW and about"
32,Pop up share area of an online shop
19,UI for share and add location screen
221,pay screen for adding money into a paytm account
68,Healthy Food options to add in daily Plan
141,a screen with information about particular app
12,Hushed-Login this app......you enter a new world of foods
375,Using our advanced ovulation calculator online is the most reliable way of knowing your ovulation date
203,flight preferences San Francisco to New York and search tickets button
430,Period and fertility forecast with cycle length
299,Map for atms
321,audio editor with harmony function
233,menu providing different buttons to change the settings and to get more information
220,daily sport program
65,AN android app
456,zone with different area
145,cars seller with location button
17,customer complaint service
194,login screen with email and password or via facebook or google
155,option screen with user account
349,cover page of book with author name
128,create customized emoji
81,online dating
22,stopwatch with timer
20,my profile in Azar application
341,"social app with ask me, gender, ask me, chat options"
423,"saving items with complete , complete this group manually or exit"
191,Product listing with main filter
80,verify entered information before proceeding
404,music instruments with highest reviews
210,task scheduler app showing task handlers
346,search cellular locations
412,Scientific Calculator Mobile Application
207,football match details with upcoming match information
327,buying boats
67,"A Social media app with options like chat, mute and Followers"
103,timetable with title and place
55,choose thw word preferences
156,"Read Qur‘an, Last read history, search specific parts,prayer time,settings"
292,displays the latest news in page
295,news
2,"search bar with links ,articles and personal option"
119,music score chart with audio
28,Weather details for city with option in Celsius and Fahrenheit
123,Tutorial for dog training
202,Music playlist
359,a survery app with sinup and facebook login option
50,"Delivery details input boxes for address and buttons for home, work or other"
240,online shopping app
23,More options for user
353,Vippi GUI sign up interface
195,"Text (story) reading with formatting options, search functionality"
133,Login with radio button with calendar
77,Location with location selected as current location
108,books
199,login with username and password
381,Open the application using a password
192,headlines tody
143,Find friends
299,Tiny Scanner
236,search bar with serch list and home menus
172,find your current location
